{
  "components": [
    {
      "actual_distribution_status": "candidate-input-not-actual-package-closure",
      "applicable_targets": [
        "cpython-3.10-darwin-arm64",
        "cpython-3.10-darwin-x86_64",
        "cpython-3.10-linux-x86_64",
        "cpython-3.10-win32-amd64",
        "cpython-3.11-darwin-arm64",
        "cpython-3.11-darwin-x86_64",
        "cpython-3.11-linux-x86_64",
        "cpython-3.11-win32-amd64",
        "cpython-3.12-darwin-arm64",
        "cpython-3.12-darwin-x86_64",
        "cpython-3.12-linux-x86_64",
        "cpython-3.12-win32-amd64"
      ],
      "evidence_expression": "Apache-2.0",
      "evidence_review_status": "repository-evidence-checked",
      "id": "python:absl-py",
      "kind": "python",
      "license_text_detail": "all license bodies captured by the bounded repository evidence scope",
      "license_text_status": "complete-within-declared-evidence-scope",
      "license_texts": [
        {
          "path": "third_party/licenses/corpus/50e6751797c50dedd75ef1b8a0d9e42f5f8472e9fbce91f34718e9f97b0c780a.txt",
          "sha256": "50e6751797c50dedd75ef1b8a0d9e42f5f8472e9fbce91f34718e9f97b0c780a",
          "size": 11324
        }
      ],
      "name": "absl-py",
      "notice_status": "no-separate-text-observed-obligation-review-pending",
      "notice_texts": [],
      "role": "python-package-profile-input",
      "source_url": "https://github.com/abseil/abseil-py",
      "version": "2.5.0"
    },
    {
      "actual_distribution_status": "candidate-input-not-actual-package-closure",
      "applicable_targets": [
        "cpython-3.10-darwin-arm64",
        "cpython-3.10-darwin-x86_64",
        "cpython-3.10-linux-x86_64",
        "cpython-3.10-win32-amd64",
        "cpython-3.11-darwin-arm64",
        "cpython-3.11-darwin-x86_64",
        "cpython-3.11-linux-x86_64",
        "cpython-3.11-win32-amd64",
        "cpython-3.12-darwin-arm64",
        "cpython-3.12-darwin-x86_64",
        "cpython-3.12-linux-x86_64",
        "cpython-3.12-win32-amd64"
      ],
      "evidence_expression": "MIT",
      "evidence_review_status": "repository-evidence-checked",
      "id": "python:altgraph",
      "kind": "python",
      "license_text_detail": "all license bodies captured by the bounded repository evidence scope",
      "license_text_status": "complete-within-declared-evidence-scope",
      "license_texts": [
        {
          "path": "third_party/licenses/corpus/6c194d6db0c64d45535d10c95142b9b0cda7b7dcc7f1ddee302b3d536f3dbe46.txt",
          "sha256": "6c194d6db0c64d45535d10c95142b9b0cda7b7dcc7f1ddee302b3d536f3dbe46",
          "size": 1002
        }
      ],
      "name": "altgraph",
      "notice_status": "no-separate-text-observed-obligation-review-pending",
      "notice_texts": [],
      "role": "python-package-profile-input",
      "source_url": "https://altgraph.readthedocs.io",
      "version": "0.17.5"
    },
    {
      "actual_distribution_status": "candidate-input-not-actual-package-closure",
      "applicable_targets": [
        "cpython-3.10-darwin-arm64",
        "cpython-3.10-darwin-x86_64",
        "cpython-3.10-linux-x86_64",
        "cpython-3.10-win32-amd64",
        "cpython-3.11-darwin-arm64",
        "cpython-3.11-darwin-x86_64",
        "cpython-3.11-linux-x86_64",
        "cpython-3.11-win32-amd64",
        "cpython-3.12-darwin-arm64",
        "cpython-3.12-darwin-x86_64",
        "cpython-3.12-linux-x86_64",
        "cpython-3.12-win32-amd64"
      ],
      "evidence_expression": "MIT",
      "evidence_review_status": "repository-evidence-checked",
      "id": "python:ast-serialize",
      "kind": "python",
      "license_text_detail": "all license bodies captured by the bounded repository evidence scope",
      "license_text_status": "complete-within-declared-evidence-scope",
      "license_texts": [
        {
          "path": "third_party/licenses/corpus/0105734bec61b8396baa9c16a202379368ef243502524f5001fba0229d478b8d.txt",
          "sha256": "0105734bec61b8396baa9c16a202379368ef243502524f5001fba0229d478b8d",
          "size": 1190
        }
      ],
      "name": "ast-serialize",
      "notice_status": "no-separate-text-observed-obligation-review-pending",
      "notice_texts": [],
      "role": "python-package-profile-input",
      "source_url": "https://github.com/mypyc/ast_serialize",
      "version": "0.6.0"
    },
    {
      "actual_distribution_status": "candidate-input-not-actual-package-closure",
      "applicable_targets": [
        "cpython-3.10-darwin-arm64",
        "cpython-3.10-darwin-x86_64",
        "cpython-3.10-linux-x86_64",
        "cpython-3.10-win32-amd64",
        "cpython-3.11-darwin-arm64",
        "cpython-3.11-darwin-x86_64",
        "cpython-3.11-linux-x86_64",
        "cpython-3.11-win32-amd64",
        "cpython-3.12-darwin-arm64",
        "cpython-3.12-darwin-x86_64",
        "cpython-3.12-linux-x86_64",
        "cpython-3.12-win32-amd64"
      ],
      "evidence_expression": "MIT",
      "evidence_review_status": "repository-evidence-checked",
      "id": "python:axe-playwright-python",
      "kind": "python",
      "license_text_detail": "all license bodies captured by the bounded repository evidence scope",
      "license_text_status": "complete-within-declared-evidence-scope",
      "license_texts": [
        {
          "path": "third_party/licenses/corpus/6a06a65cf27b3f66b5fcae2743f9a958fad69749e1fb4cbd3d09aa5ac33673ba.txt",
          "sha256": "6a06a65cf27b3f66b5fcae2743f9a958fad69749e1fb4cbd3d09aa5ac33673ba",
          "size": 1081
        }
      ],
      "name": "axe-playwright-python",
      "notice_status": "no-separate-text-observed-obligation-review-pending",
      "notice_texts": [],
      "role": "python-package-profile-input",
      "source_url": "https://pamelafox.github.io/axe-playwright-python",
      "version": "0.1.7"
    },
    {
      "actual_distribution_status": "candidate-input-not-actual-package-closure",
      "applicable_targets": [
        "cpython-3.10-win32-amd64",
        "cpython-3.11-win32-amd64",
        "cpython-3.12-win32-amd64"
      ],
      "evidence_expression": "BSD-3-Clause",
      "evidence_review_status": "repository-evidence-checked",
      "id": "python:colorama",
      "kind": "python",
      "license_text_detail": "all license bodies captured by the bounded repository evidence scope",
      "license_text_status": "complete-within-declared-evidence-scope",
      "license_texts": [
        {
          "path": "third_party/licenses/corpus/cac35c02686e5d04a5a7140bfb3b36e73aed496656e891102e428886d7930318.txt",
          "sha256": "cac35c02686e5d04a5a7140bfb3b36e73aed496656e891102e428886d7930318",
          "size": 1491
        }
      ],
      "name": "colorama",
      "notice_status": "no-separate-text-observed-obligation-review-pending",
      "notice_texts": [],
      "role": "python-package-profile-input",
      "source_url": "https://github.com/tartley/colorama",
      "version": "0.4.6"
    },
    {
      "actual_distribution_status": "candidate-input-not-actual-package-closure",
      "applicable_targets": [
        "cpython-3.10-darwin-arm64",
        "cpython-3.10-darwin-x86_64",
        "cpython-3.10-linux-x86_64",
        "cpython-3.10-win32-amd64",
        "cpython-3.11-darwin-arm64",
        "cpython-3.11-darwin-x86_64",
        "cpython-3.11-linux-x86_64",
        "cpython-3.11-win32-amd64",
        "cpython-3.12-darwin-arm64",
        "cpython-3.12-darwin-x86_64",
        "cpython-3.12-linux-x86_64",
        "cpython-3.12-win32-amd64"
      ],
      "evidence_expression": "BSD-3-Clause",
      "evidence_review_status": "repository-evidence-checked",
      "id": "python:contourpy",
      "kind": "python",
      "license_text_detail": "all license bodies captured by the bounded repository evidence scope",
      "license_text_status": "complete-within-declared-evidence-scope",
      "license_texts": [
        {
          "path": "third_party/licenses/corpus/34170979fc64f4f5e6dfa66ef27dec314ffffc5852000c60f4836ec1dfbf156e.txt",
          "sha256": "34170979fc64f4f5e6dfa66ef27dec314ffffc5852000c60f4836ec1dfbf156e",
          "size": 1534
        }
      ],
      "name": "contourpy",
      "notice_status": "no-separate-text-observed-obligation-review-pending",
      "notice_texts": [],
      "role": "python-package-profile-input",
      "source_url": "https://github.com/contourpy/contourpy",
      "version": "1.3.2"
    },
    {
      "actual_distribution_status": "candidate-input-not-actual-package-closure",
      "applicable_targets": [
        "cpython-3.10-darwin-arm64",
        "cpython-3.10-darwin-x86_64",
        "cpython-3.10-linux-x86_64",
        "cpython-3.10-win32-amd64",
        "cpython-3.11-darwin-arm64",
        "cpython-3.11-darwin-x86_64",
        "cpython-3.11-linux-x86_64",
        "cpython-3.11-win32-amd64",
        "cpython-3.12-darwin-arm64",
        "cpython-3.12-darwin-x86_64",
        "cpython-3.12-linux-x86_64",
        "cpython-3.12-win32-amd64"
      ],
      "evidence_expression": "Apache-2.0",
      "evidence_review_status": "repository-evidence-checked",
      "id": "python:coverage",
      "kind": "python",
      "license_text_detail": "all license bodies captured by the bounded repository evidence scope",
      "license_text_status": "complete-within-declared-evidence-scope",
      "license_texts": [
        {
          "path": "third_party/licenses/corpus/bb28c48e3e078166e91cfc2b6db7ffebb8a0973b9e23b3df060561292d8d69ec.txt",
          "sha256": "bb28c48e3e078166e91cfc2b6db7ffebb8a0973b9e23b3df060561292d8d69ec",
          "size": 10140
        }
      ],
      "name": "coverage",
      "notice_status": "no-separate-text-observed-obligation-review-pending",
      "notice_texts": [],
      "role": "python-package-profile-input",
      "source_url": "https://github.com/coveragepy/coveragepy",
      "version": "7.15.2"
    },
    {
      "actual_distribution_status": "candidate-input-not-actual-package-closure",